{
  "apiVersion": "axf/v0",
  "kind": "Alter",
  "metadata": {
    "id": "urn:axf:alter:5e6f7a8b-9c0d-4e1f-2a3b-4c5d6e7f8091",
    "name": "duplicate-assets",
    "owner": {
      "keyType": "ed25519",
      "publicKeyFingerprint": "sha256:5e6f7a8b9c0d1e2f3a4b5c6d7e8f9012a3b4c5d6e7f8091a2b3c4d5e6f7a8b9"
    }
  },
  "capabilities": [
    { "type": "shell" }
  ],
  "assets": [
    {
      "name": "github-token",
      "kind": "ref",
      "uri": "keychain://axf/github-token",
      "ownerSignature": {
        "algorithm": "ed25519",
        "canonicalization": "JCS-RFC8785",
        "signedAt": "2026-08-09T10:00:00Z",
        "value": "base64:MEQCIBx7=="
      }
    },
    {
      "name": "github-token",
      "kind": "ref",
      "uri": "keychain://axf/other-token",
      "ownerSignature": {
        "algorithm": "ed25519",
        "canonicalization": "JCS-RFC8785",
        "signedAt": "2026-08-09T10:00:00Z",
        "value": "base64:MEQCIBx8=="
      }
    }
  ]
}
