{
  "apiVersion": "axf/v0",
  "kind": "Alter",
  "metadata": {
    "id": "urn:axf:alter:1a2b3c4d-5e6f-4a7b-8b9c-0d1e2f3a4b5c",
    "name": "field-researcher",
    "owner": {
      "keyType": "ed25519",
      "publicKeyFingerprint": "sha256:1a2b3c4d5e6f7089a1b2c3d4e5f6a7b8c9d0e1f2a3b4c5d6e7f8091a2b3c4d5"
    }
  },
  "capabilities": [
    {
      "type": "shell",
      "config": { "promptLabel": "researcher" }
    }
  ]
}
